[
  {
    "id": "ramesh-2013-self-titration",
    "name": "Self-titration (reduced inhalation at higher active-puff conditions)",
    "description": "Participants inhaled less smoke from active cigarettes than from position-matched inactive cigarettes, and expired CO fell at higher active-puff conditions — both indicate participants reduced how much they actually inhaled as nominal active dose rose, partially decoupling nominal dose from realized exposure.",
    "interpretation_source": "demonstrated mechanism",
    "supporting_claims": ["ramesh-2013-co-dose", "ramesh-2013-cigarette-weight-self-titration"],
    "study_id": "ramesh-2013",
    "source_ref": "Results P25-P26; Discussion P27"
  },
  {
    "id": "ramesh-2013-expectancy",
    "name": "Expectancy effects on subjective ratings",
    "description": "Authors hypothesize that because active puffs were always smoked before inactive puffs, the direct effects of the first two active puffs raised participants' expectation that subsequent puffs were also active — leading them to rate 2, 4, and 6 puffs similarly despite differing cardiovascular responses. Cites prior literature (Camí et al. 1991; Metrik et al. 2009) that subjective responses are more expectancy-sensitive than physiological ones.",
    "interpretation_source": "author interpretation",
    "supporting_claims": ["ramesh-2013-mrf-not-dose-dependent", "ramesh-2013-vas-high-not-dose-dependent"],
    "study_id": "ramesh-2013",
    "source_ref": "Discussion P28"
  },
  {
    "id": "ramesh-2013-tolerance-limitation",
    "name": "Tolerance in heavy/daily users may mask subtle dose differences",
    "description": "Study limitation raised by authors: because the sample was daily marijuana smokers, tolerance to subjective/performance-impairing effects may make it harder for this population to distinguish subtle differences within a narrow active-dose range. Authors note results might differ in a less-exposed population.",
    "interpretation_source": "author interpretation",
    "supporting_claims": ["ramesh-2013-mrf-not-dose-dependent", "ramesh-2013-vas-high-not-dose-dependent"],
    "study_id": "ramesh-2013",
    "source_ref": "Discussion P29"
  },
  {
    "id": "bidwell-2020-self-titration-hypothesis",
    "name": "Self-titration to similar THC exposure within product form",
    "description": "Because 16% vs 24% flower (and 70% vs 90% concentrate) did not produce significantly different blood THC levels, authors suggest users may be self-titrating -- adjusting how much they consume -- to reach a similar target level of exposure as labeled potency rises within a form. This is an inference from an absence of a potency effect, not a directly observed titration behavior (contrast with ramesh-2013-self-titration, where reduced inhalation was directly measured via CO and cigarette weight).",
    "interpretation_source": "author interpretation",
    "supporting_claims": ["bidwell-2020-no-within-form-potency-effect"],
    "study_id": "bidwell-2020",
    "source_ref": "Discussion (H1-4), paragraph 2"
  },
  {
    "id": "bidwell-2020-tolerance-hypothesis",
    "name": "Greater tolerance in concentrate users",
    "description": "Proposed explanation for why concentrate users, despite ~2.3x higher plasma THC, did not show correspondingly higher subjective intoxication: concentrate users may have greater tolerance to THC's psychoactive effects from more frequent/higher exposure. Explicitly framed by the authors as one of three competing possibilities requiring future research, not a demonstrated mechanism in this study.",
    "interpretation_source": "author interpretation",
    "supporting_claims": ["bidwell-2020-intoxication-not-different-by-form", "bidwell-2020-plasma-thc-concentrate-gt-flower"],
    "study_id": "bidwell-2020",
    "source_ref": "Discussion (H1-4), paragraph 3"
  },
  {
    "id": "bidwell-2020-receptor-saturation-hypothesis",
    "name": "CB1 receptor saturation / diminishing returns at high THC",
    "description": "Second proposed (unproven) explanation: cannabinoid CB1 receptors, as a partial-agonist target of THC, may become saturated at higher THC levels, beyond which additional THC produces diminishing subjective effect. Explicitly speculative in the source.",
    "interpretation_source": "author interpretation",
    "supporting_claims": ["bidwell-2020-intoxication-not-different-by-form"],
    "study_id": "bidwell-2020",
    "source_ref": "Discussion (H1-4), paragraph 3"
  },
  {
    "id": "bidwell-2020-individual-variability-hypothesis",
    "name": "Individual differences in metabolism/sensitivity",
    "description": "Third proposed (unproven) explanation: genetic or other pre-existing biological differences in cannabinoid metabolism or sensitivity among users could account for the dissociation between blood THC and subjective intoxication. Explicitly speculative; authors state future research is needed to test all three candidate mechanisms.",
    "interpretation_source": "author interpretation",
    "supporting_claims": ["bidwell-2020-intoxication-not-different-by-form"],
    "study_id": "bidwell-2020",
    "source_ref": "Discussion (H1-4), paragraph 3"
  },
  {
    "id": "mccartney-2021-tolerance-in-regular-users-hypothesis",
    "name": "Regular users are less behaviorally sensitive to THC, decoupling biomarkers from impairment",
    "description": "Proposed explanation for why biomarker-impairment correlations existed (weakly) in occasional users but vanished entirely in regular users: regular cannabis users may be less sensitive to THC's impairing effects (consistent with the prior McCartney et al. 2021b review and other cited work), so a given blood concentration produces less consistent behavioral impairment in them, weakening the very relationship that per se legal limits assume. Authors also separately flag reduced statistical robustness (smaller/more homogeneous samples) as a competing, non-substantive explanation for the null result -- both are presented as possibilities, not settled.",
    "interpretation_source": "author interpretation",
    "supporting_claims": ["mccartney-2021-no-biomarker-relationship-in-regular-users"],
    "study_id": "mccartney-2021",
    "source_ref": "Discussion, paragraphs on regular vs occasional users"
  },
  {
    "id": "mccartney-2021-metabolite-kinetics-hypothesis",
    "name": "11-COOH-THC's slow decline may coincidentally track impairment's time course better than THC itself",
    "description": "The single strongest biomarker-impairment relationship found (R=-0.43, inhaled, occasional users) was for 11-COOH-THC -- a non-intoxicating, inactive metabolite. Authors propose this is because blood THC and 11-OH-THC peak and decline rapidly after inhalation while 11-COOH-THC declines gradually, and that gradual decline may better match impairment's actual time course (~3-10h) even though 11-COOH-THC itself has no pharmacological activity. Explicitly flagged as unexpected ('unexpected given that 11-COOH-THC is non-intoxicating') and interpretive, not a demonstrated causal mechanism -- and the authors separately warn that 11-COOH-THC persists in blood for >7 days, well beyond the impairment window, meaning it would perform badly as a practical impairment marker despite this correlation.",
    "interpretation_source": "author interpretation",
    "supporting_claims": ["mccartney-2021-biomarkers-weak-in-occasional-users"],
    "study_id": "mccartney-2021",
    "source_ref": "Discussion, paragraph on 11-COOH-THC"
  }
]
